{
  "$schema": "https://json-schema.org/draft/2020-12/schema",
  "title": "Learning Confirmed Evidence Cohort",
  "type": "object",
  "additionalProperties": false,
  "required": [
    "$schema",
    "artifact_kind",
    "generated_at",
    "producer",
    "source_command",
    "source_revision",
    "source_tree_fingerprint",
    "input_fingerprints",
    "schema_version",
    "artifact_status",
    "retention_policy",
    "encoding",
    "currentness",
    "vault",
    "policy",
    "status",
    "summary",
    "cohort_identity",
    "source_bundle",
    "run_evidence",
    "family_cohorts",
    "predicate_results",
    "revocation"
  ],
  "properties": {
    "$schema": {
      "type": "string",
      "enum": ["ops/schemas/learning-confirmed-evidence-cohort.schema.json"]
    },
    "artifact_kind": {
      "type": "string",
      "enum": ["learning_confirmed_evidence_cohort"]
    },
    "generated_at": { "type": "string", "pattern": "^\\d{4}-\\d{2}-\\d{2}T\\d{2}:\\d{2}:\\d{2}Z$" },
    "producer": { "type": "string", "enum": ["ops.scripts.learning_confirmed_evidence_cohort"] },
    "source_command": { "type": "string", "minLength": 1 },
    "source_revision": { "type": "string", "minLength": 1 },
    "source_tree_fingerprint": { "type": "string", "minLength": 1 },
    "input_fingerprints": {
      "type": "object",
      "additionalProperties": { "type": "string", "minLength": 1 }
    },
    "schema_version": { "type": "integer", "minimum": 1 },
    "artifact_status": { "type": "string", "enum": ["current", "archived", "stale", "unknown"] },
    "retention_policy": { "type": "string", "enum": ["canonical_report"] },
    "encoding": { "type": "string", "enum": ["utf-8"] },
    "currentness": {
      "type": "object",
      "additionalProperties": false,
      "required": ["status", "checked_at"],
      "properties": {
        "status": { "type": "string", "enum": ["current", "stale", "unknown", "invalid"] },
        "checked_at": { "type": "string", "pattern": "^\\d{4}-\\d{2}-\\d{2}T\\d{2}:\\d{2}:\\d{2}Z$" }
      }
    },
    "vault": { "type": "string" },
    "policy": {
      "type": "object",
      "additionalProperties": false,
      "required": ["path", "version"],
      "properties": {
        "path": { "type": "string" },
        "version": { "type": ["integer", "string", "null"] }
      }
    },
    "status": { "type": "string", "enum": ["pass", "fail"] },
    "summary": {
      "type": "object",
      "additionalProperties": false,
      "required": [
        "cohort_sha256",
        "confirmed_evidence_status",
        "confirmed_learning_improvement_allowed",
        "evidence_bundle_status",
        "run_count",
        "valid_run_count",
        "selected_valid_run_ids",
        "rejected_run_count",
        "rejected_run_diagnostics",
        "legacy_reconstruction_summary",
        "family_count",
        "eligible_family_count",
        "eligible_family_ids",
        "max_valid_run_count",
        "min_required_run_count",
        "min_family_consistency_count",
        "blocking_predicate_ids"
      ],
      "properties": {
        "cohort_sha256": { "$ref": "#/$defs/sha256" },
        "confirmed_evidence_status": {
          "type": "string",
          "enum": ["not_ready", "auto_confirmed", "revoked"]
        },
        "confirmed_learning_improvement_allowed": { "type": "boolean" },
        "evidence_bundle_status": { "$ref": "#/$defs/revocation_status" },
        "run_count": { "type": "integer", "minimum": 0 },
        "valid_run_count": { "type": "integer", "minimum": 0 },
        "selected_valid_run_ids": {
          "type": "array",
          "items": { "type": "string", "minLength": 1 }
        },
        "rejected_run_count": { "type": "integer", "minimum": 0 },
        "rejected_run_diagnostics": {
          "type": "array",
          "items": { "$ref": "#/$defs/rejected_run_diagnostic" }
        },
        "legacy_reconstruction_summary": { "$ref": "#/$defs/legacy_reconstruction_summary" },
        "family_count": { "type": "integer", "minimum": 0 },
        "eligible_family_count": { "type": "integer", "minimum": 0 },
        "eligible_family_ids": {
          "type": "array",
          "items": { "type": "string", "minLength": 1 },
          "uniqueItems": true
        },
        "max_valid_run_count": { "type": "integer", "minimum": 0 },
        "min_required_run_count": { "type": "integer", "minimum": 1 },
        "min_family_consistency_count": { "type": "integer", "minimum": 1 },
        "blocking_predicate_ids": { "type": "array", "items": { "type": "string", "minLength": 1 } }
      }
    },
    "cohort_identity": {
      "type": "object",
      "additionalProperties": false,
      "required": ["digest_algorithm", "cohort_payload_version", "cohort_digest"],
      "properties": {
        "digest_algorithm": { "type": "string", "enum": ["sha256"] },
        "cohort_payload_version": { "type": "integer", "minimum": 1 },
        "cohort_digest": { "$ref": "#/$defs/sha256" }
      }
    },
    "source_bundle": {
      "type": "object",
      "additionalProperties": false,
      "required": [
        "path",
        "bundle_sha256",
        "current_bundle_sha256",
        "bundle_status",
        "revocation_status",
        "fingerprint_match_status"
      ],
      "properties": {
        "path": { "type": "string", "minLength": 1 },
        "bundle_sha256": { "type": "string", "pattern": "^(|[a-f0-9]{64})$" },
        "current_bundle_sha256": { "type": "string", "pattern": "^(|[a-f0-9]{64})$" },
        "bundle_status": {
          "type": "string",
          "enum": ["active", "stale", "revoked", "missing", "not_evaluated"]
        },
        "revocation_status": { "$ref": "#/$defs/revocation_status" },
        "fingerprint_match_status": {
          "type": "string",
          "enum": ["match", "mismatch", "missing", "not_evaluated"]
        }
      }
    },
    "run_evidence": {
      "type": "array",
      "items": { "$ref": "#/$defs/run_evidence" }
    },
    "family_cohorts": {
      "type": "array",
      "items": { "$ref": "#/$defs/family_cohort" }
    },
    "predicate_results": {
      "type": "array",
      "items": { "$ref": "#/$defs/predicate" }
    },
    "revocation": {
      "type": "object",
      "additionalProperties": false,
      "required": ["status", "reasons"],
      "properties": {
        "status": { "$ref": "#/$defs/revocation_status" },
        "reasons": { "type": "array", "items": { "type": "string", "minLength": 1 } }
      }
    }
  },
  "$defs": {
    "sha256": { "type": "string", "pattern": "^[a-f0-9]{64}$" },
    "revocation_status": { "type": "string", "enum": ["active", "stale", "revoked"] },
    "rejected_run_diagnostic": {
      "type": "object",
      "additionalProperties": false,
      "required": ["run_id", "decision", "families", "status", "reasons", "missing_artifacts"],
      "properties": {
        "run_id": { "type": "string" },
        "decision": { "type": "string" },
        "families": { "type": "array", "items": { "type": "string" } },
        "status": { "type": "string", "enum": ["fail", "pass"] },
        "reasons": { "type": "array", "items": { "type": "string", "minLength": 1 } },
        "missing_artifacts": {
          "type": "array",
          "items": {
            "type": "string",
            "enum": ["baseline_mechanism_assessment", "candidate_mechanism_assessment", "promotion_report"]
          }
        }
      }
    },
    "run_evidence": {
      "type": "object",
      "additionalProperties": false,
      "required": [
        "run_id",
        "families",
        "telemetry_path",
        "decision",
        "behavior_delta_path",
        "behavior_delta_digest",
        "behavior_delta_digest_source",
        "behavior_delta_artifact_sha256",
        "behavior_delta_artifact_digest_match",
        "confirmed_run_artifacts",
        "confirmed_run_artifact_binding_status",
        "confirmed_run_artifact_missing_count",
        "confirmed_run_artifact_missing_ids",
        "legacy_reconstruction_status",
        "legacy_reconstruction_selection_reason",
        "legacy_reconstruction_reasons",
        "secondary_axis_evidence_source",
        "secondary_axis_evidence_detail",
        "strict_secondary_improvement_present",
        "secondary_improvement_axes",
        "behavior_changed",
        "delta_count",
        "before_after_evidence_present",
        "valid_for_confirmed_claim",
        "status",
        "reasons"
      ],
      "properties": {
        "run_id": { "type": "string" },
        "families": { "type": "array", "items": { "type": "string" }, "uniqueItems": true },
        "telemetry_path": { "type": "string" },
        "decision": { "type": "string" },
        "behavior_delta_path": { "type": "string" },
        "behavior_delta_digest": { "type": "string" },
        "behavior_delta_digest_source": {
          "type": "string",
          "enum": ["telemetry_field", "artifact_readback", "legacy_reconstruction_artifact", "missing", ""]
        },
        "behavior_delta_artifact_sha256": { "type": "string", "pattern": "^(|[a-f0-9]{64})$" },
        "behavior_delta_artifact_digest_match": { "type": "boolean" },
        "confirmed_run_artifacts": {
          "type": "array",
          "items": { "$ref": "#/$defs/confirmed_run_artifact" }
        },
        "confirmed_run_artifact_binding_status": {
          "type": "string",
          "enum": ["pass", "missing_required_artifact", "missing"]
        },
        "confirmed_run_artifact_missing_count": { "type": "integer", "minimum": 0 },
        "confirmed_run_artifact_missing_ids": {
          "type": "array",
          "items": {
            "type": "string",
            "enum": ["baseline_mechanism_assessment", "candidate_mechanism_assessment", "promotion_report"]
          }
        },
        "legacy_reconstruction_status": {
          "type": "string",
          "enum": ["not_applicable", "not_needed", "reconstructed", "blocked"]
        },
        "legacy_reconstruction_selection_reason": { "type": "string" },
        "legacy_reconstruction_reasons": { "type": "array", "items": { "type": "string" } },
        "secondary_axis_evidence_source": {
          "type": "string",
          "enum": ["telemetry_field", "legacy_reconstruction_artifact", "missing"]
        },
        "secondary_axis_evidence_detail": { "type": "string" },
        "strict_secondary_improvement_present": { "type": "boolean" },
        "secondary_improvement_axes": { "type": "array", "items": { "type": "string" } },
        "behavior_changed": { "type": "boolean" },
        "delta_count": { "type": "integer", "minimum": 0 },
        "before_after_evidence_present": { "type": "boolean" },
        "valid_for_confirmed_claim": { "type": "boolean" },
        "status": { "type": "string", "enum": ["pass", "fail"] },
        "reasons": { "type": "array", "items": { "type": "string", "minLength": 1 } }
      }
    },
    "legacy_reconstruction_summary": {
      "type": "object",
      "additionalProperties": false,
      "required": [
        "status",
        "reconstruction_needed_count",
        "reconstructed_run_count",
        "blocked_run_count",
        "run_diagnostics"
      ],
      "properties": {
        "status": { "type": "string", "enum": ["not_used", "pass", "fail"] },
        "reconstruction_needed_count": { "type": "integer", "minimum": 0 },
        "reconstructed_run_count": { "type": "integer", "minimum": 0 },
        "blocked_run_count": { "type": "integer", "minimum": 0 },
        "run_diagnostics": {
          "type": "array",
          "items": { "$ref": "#/$defs/legacy_reconstruction_run_diagnostic" }
        }
      }
    },
    "legacy_reconstruction_run_diagnostic": {
      "type": "object",
      "additionalProperties": false,
      "required": [
        "run_id",
        "families",
        "reconstruction_status",
        "selection_reason",
        "reconstruction_reasons",
        "secondary_axis_evidence_source",
        "secondary_axis_evidence_detail",
        "parsed_secondary_axes"
      ],
      "properties": {
        "run_id": { "type": "string", "minLength": 1 },
        "families": { "type": "array", "items": { "type": "string" } },
        "reconstruction_status": {
          "type": "string",
          "enum": ["not_applicable", "not_needed", "reconstructed", "blocked"]
        },
        "selection_reason": { "type": "string" },
        "reconstruction_reasons": { "type": "array", "items": { "type": "string" } },
        "secondary_axis_evidence_source": {
          "type": "string",
          "enum": ["telemetry_field", "legacy_reconstruction_artifact", "missing"]
        },
        "secondary_axis_evidence_detail": { "type": "string" },
        "parsed_secondary_axes": { "type": "array", "items": { "type": "string" } }
      }
    },
    "family_cohort": {
      "type": "object",
      "additionalProperties": false,
      "required": [
        "family",
        "run_ids",
        "run_count",
        "valid_run_ids",
        "valid_run_count",
        "min_required_run_count",
        "status",
        "reason"
      ],
      "properties": {
        "family": { "type": "string", "minLength": 1 },
        "run_ids": { "type": "array", "items": { "type": "string" } },
        "run_count": { "type": "integer", "minimum": 0 },
        "valid_run_ids": { "type": "array", "items": { "type": "string" } },
        "valid_run_count": { "type": "integer", "minimum": 0 },
        "min_required_run_count": { "type": "integer", "minimum": 1 },
        "status": { "type": "string", "enum": ["pass", "fail"] },
        "reason": { "type": "string", "minLength": 1 }
      }
    },
    "confirmed_run_artifact": {
      "type": "object",
      "additionalProperties": false,
      "required": ["id", "path", "exists", "sha256", "required_for_confirmed", "status"],
      "properties": {
        "id": {
          "type": "string",
          "enum": ["baseline_mechanism_assessment", "candidate_mechanism_assessment", "promotion_report"]
        },
        "path": { "type": "string", "minLength": 1 },
        "exists": { "type": "boolean" },
        "sha256": { "type": "string", "pattern": "^(|[a-f0-9]{64})$" },
        "required_for_confirmed": { "type": "boolean" },
        "status": { "type": "string", "enum": ["present", "missing"] }
      }
    },
    "predicate": {
      "type": "object",
      "additionalProperties": false,
      "required": [
        "id",
        "status",
        "source_path",
        "required_condition",
        "observed_value",
        "summary"
      ],
      "properties": {
        "id": { "type": "string", "minLength": 1 },
        "status": { "type": "string", "enum": ["pass", "fail", "not_applicable"] },
        "source_path": { "type": "string", "minLength": 1 },
        "required_condition": { "type": "string", "minLength": 1 },
        "observed_value": { "type": "string", "minLength": 1 },
        "summary": { "type": "string", "minLength": 1 }
      }
    }
  }
}
