{
  "$schema": "ops/schemas/learning-confirmed-evidence-cohort.schema.json",
  "artifact_kind": "learning_confirmed_evidence_cohort",
  "generated_at": "2026-05-15T17:09:48Z",
  "producer": "ops.scripts.learning_confirmed_evidence_cohort",
  "source_command": "python -m ops.scripts.learning_confirmed_evidence_cohort --vault .",
  "source_revision": "unknown",
  "source_tree_fingerprint": "d17ebc7dc9aa48f70472ceef3cc662e8acb8a144ce1bca343f8618d867c63a99",
  "input_fingerprints": {
    "policy": "ebc1bcb948ab54d95dc99bbaed08fbd75b5756dc943c94aa3e2db6321170488f",
    "schema": "8c3178155a66500faa6980395a127016ff8d3dc12163d13c5091b32fde54d9af",
    "artifact_envelope_schema": "87fcb7b91ffc04e8180c1c3e51e309cde186ecf23f91f7974a541d0b580976de",
    "source_paths": "bb2b3947b63a1c821751be9887477d93589a392612908825b73b590d5bf80e60",
    "confirmed_policy": "5e86b887186269f50558391f58a47354a3db210845541c2d30f0f41855937f52",
    "learning_claim_evidence_bundle": "11291fb8fa5647eb22293687da4d1f4a9cf199fe526adfc29019bd48afe07e2e",
    "mutation_proposals": "6eb3aa9805813939999e810450bd6d7efcf1ac71da6835b01a309b18dafd7487",
    "confirmed_behavior_delta": "134969a5ecf16a917fee6939cf3eaa7bbc36b3482a227e5ec46479c46041505f",
    "confirmed_run_artifacts": "dd1a6711abaed914f144bf0575730b3c36ad368ab91fe530121393cef3c7ca9d",
    "confirmed_run_telemetry": "28eb2b94ce518e6fa681f5aec6dec26699568e244393237772e71d9a5d292f95"
  },
  "schema_version": 1,
  "artifact_status": "current",
  "retention_policy": "canonical_report",
  "encoding": "utf-8",
  "currentness": {
    "status": "current",
    "checked_at": "2026-05-15T17:09:48Z"
  },
  "vault": ".",
  "policy": {
    "path": "ops/policies/wiki-maintainer-policy.yaml",
    "version": 4
  },
  "status": "pass",
  "summary": {
    "cohort_sha256": "778bf1b74a8670528d3684757fcb554e20fdf33247fdbb9baccd4c55d0ae84ac",
    "confirmed_evidence_status": "auto_confirmed",
    "confirmed_learning_improvement_allowed": true,
    "evidence_bundle_status": "active",
    "run_count": 5,
    "valid_run_count": 3,
    "selected_valid_run_ids": [
      "run-20260422-auto-improve-timeout-telemetry-fallback",
      "run-20260507-auto-improve-existing-telemetry-inline-same-eval-replacement",
      "run-20260507-auto-improve-iteration-persistence-discard-path"
    ],
    "rejected_run_count": 2,
    "rejected_run_diagnostics": [
      {
        "run_id": "run-20260422-auto-improve-decision-record-fallback-retry3-linux-tmp",
        "decision": "DISCARD",
        "families": [
          "contract_regression_signals"
        ],
        "status": "fail",
        "reasons": [
          "decision=DISCARD"
        ],
        "missing_artifacts": []
      },
      {
        "run_id": "run-20260507-auto-improve-iteration-persistence-typed-same-eval",
        "decision": "DISCARD",
        "families": [
          "contract_regression_signals"
        ],
        "status": "fail",
        "reasons": [
          "decision=DISCARD",
          "behavior delta before/after evidence missing"
        ],
        "missing_artifacts": []
      }
    ],
    "legacy_reconstruction_summary": {
      "status": "pass",
      "reconstruction_needed_count": 1,
      "reconstructed_run_count": 1,
      "blocked_run_count": 0,
      "run_diagnostics": [
        {
          "run_id": "run-20260422-auto-improve-decision-record-fallback-retry3-linux-tmp",
          "families": [
            "contract_regression_signals"
          ],
          "reconstruction_status": "not_needed",
          "selection_reason": "selected_from_mechanism_review_candidates_for_active_same_eval_family; families=contract_regression_signals",
          "reconstruction_reasons": [],
          "secondary_axis_evidence_source": "telemetry_field",
          "secondary_axis_evidence_detail": "",
          "parsed_secondary_axes": [
            "tests"
          ]
        },
        {
          "run_id": "run-20260422-auto-improve-timeout-telemetry-fallback",
          "families": [
            "contract_regression_signals"
          ],
          "reconstruction_status": "not_needed",
          "selection_reason": "selected_from_mechanism_review_candidates_for_active_same_eval_family; families=contract_regression_signals",
          "reconstruction_reasons": [],
          "secondary_axis_evidence_source": "telemetry_field",
          "secondary_axis_evidence_detail": "",
          "parsed_secondary_axes": [
            "complexity",
            "tests"
          ]
        },
        {
          "run_id": "run-20260507-auto-improve-existing-telemetry-inline-same-eval-replacement",
          "families": [
            "contract_regression_signals"
          ],
          "reconstruction_status": "not_needed",
          "selection_reason": "selected_from_mechanism_review_candidates_for_active_same_eval_family; families=contract_regression_signals",
          "reconstruction_reasons": [],
          "secondary_axis_evidence_source": "telemetry_field",
          "secondary_axis_evidence_detail": "",
          "parsed_secondary_axes": [
            "complexity"
          ]
        },
        {
          "run_id": "run-20260507-auto-improve-iteration-persistence-discard-path",
          "families": [
            "contract_regression_signals"
          ],
          "reconstruction_status": "reconstructed",
          "selection_reason": "selected_from_mechanism_review_candidates_for_active_same_eval_family; families=contract_regression_signals",
          "reconstruction_reasons": [
            "telemetry behavior_delta_digest missing or invalid",
            "telemetry strict secondary improvement fields missing or incomplete"
          ],
          "secondary_axis_evidence_source": "legacy_reconstruction_artifact",
          "secondary_axis_evidence_detail": "allowed=true, score_equal=true, selected_axes=['lint', 'complexity', 'tests'], selected_non_regression=true, selected_any_improvement=true",
          "parsed_secondary_axes": [
            "lint",
            "complexity",
            "tests"
          ]
        },
        {
          "run_id": "run-20260507-auto-improve-iteration-persistence-typed-same-eval",
          "families": [
            "contract_regression_signals"
          ],
          "reconstruction_status": "not_needed",
          "selection_reason": "selected_from_mechanism_review_candidates_for_active_same_eval_family; families=contract_regression_signals",
          "reconstruction_reasons": [],
          "secondary_axis_evidence_source": "telemetry_field",
          "secondary_axis_evidence_detail": "",
          "parsed_secondary_axes": [
            "typed_same_eval_contract",
            "behavior_delta_digest"
          ]
        }
      ]
    },
    "family_count": 1,
    "eligible_family_count": 1,
    "eligible_family_ids": [
      "contract_regression_signals"
    ],
    "max_valid_run_count": 3,
    "min_required_run_count": 3,
    "min_family_consistency_count": 1,
    "blocking_predicate_ids": []
  },
  "cohort_identity": {
    "digest_algorithm": "sha256",
    "cohort_payload_version": 1,
    "cohort_digest": "778bf1b74a8670528d3684757fcb554e20fdf33247fdbb9baccd4c55d0ae84ac"
  },
  "source_bundle": {
    "path": "ops/reports/learning-claim-evidence-bundle.json",
    "bundle_sha256": "63ce1a1ab770bb269ada39293fb1c8f8563cf7f335927d7f181018e10a3ef637",
    "current_bundle_sha256": "63ce1a1ab770bb269ada39293fb1c8f8563cf7f335927d7f181018e10a3ef637",
    "bundle_status": "active",
    "revocation_status": "active",
    "fingerprint_match_status": "match"
  },
  "run_evidence": [
    {
      "run_id": "run-20260422-auto-improve-decision-record-fallback-retry3-linux-tmp",
      "families": [
        "contract_regression_signals"
      ],
      "telemetry_path": "runs/run-20260422-auto-improve-decision-record-fallback-retry3-linux-tmp/run-telemetry.json",
      "decision": "DISCARD",
      "behavior_delta_path": "runs/run-20260422-auto-improve-decision-record-fallback-retry3-linux-tmp/behavior-delta.json",
      "behavior_delta_digest": "bc4231630e01a551a57771095f5abe69411646b5f79fceeee2999e1163c29d66",
      "behavior_delta_digest_source": "telemetry_field",
      "behavior_delta_artifact_sha256": "bc4231630e01a551a57771095f5abe69411646b5f79fceeee2999e1163c29d66",
      "behavior_delta_artifact_digest_match": true,
      "confirmed_run_artifacts": [
        {
          "id": "baseline_mechanism_assessment",
          "path": "runs/run-20260422-auto-improve-decision-record-fallback-retry3-linux-tmp/baseline-mechanism-assessment.json",
          "exists": true,
          "sha256": "bed21273d7e47feb06b264f11a89a7167de2030362dd679373ef4a9f1e7c769f",
          "required_for_confirmed": true,
          "status": "present"
        },
        {
          "id": "candidate_mechanism_assessment",
          "path": "runs/run-20260422-auto-improve-decision-record-fallback-retry3-linux-tmp/candidate-mechanism-assessment.json",
          "exists": true,
          "sha256": "ff28767912de6d98e216edd3c2d30828c9c299bc1aaf02fdb15ec7b012ce8fc4",
          "required_for_confirmed": true,
          "status": "present"
        },
        {
          "id": "promotion_report",
          "path": "runs/run-20260422-auto-improve-decision-record-fallback-retry3-linux-tmp/promotion-report.json",
          "exists": true,
          "sha256": "8dbd94b2cf516d0485f975a282cfd77463481a2e4d33d9a4f48cbfb15d15eecd",
          "required_for_confirmed": true,
          "status": "present"
        }
      ],
      "confirmed_run_artifact_binding_status": "pass",
      "confirmed_run_artifact_missing_count": 0,
      "confirmed_run_artifact_missing_ids": [],
      "legacy_reconstruction_status": "not_needed",
      "legacy_reconstruction_selection_reason": "selected_from_mechanism_review_candidates_for_active_same_eval_family; families=contract_regression_signals",
      "legacy_reconstruction_reasons": [],
      "secondary_axis_evidence_source": "telemetry_field",